{
  "schema_version": "2.0.0",
  "lecture": {
    "id": "surg_Liver_L1",
    "specialty": "surgery",
    "title": "Liver I: Surgical Anatomy, Hepatobiliary Investigations and Liver Trauma",
    "module": "general_surgery",
    "system": "gastrointestinal",
    "source": {
      "file_name": "Liver L1- 2025.pdf",
      "page_count": 20
    },
    "tags": [
      "liver",
      "surgical anatomy",
      "couinaud segments",
      "porta hepatis",
      "hepatobiliary imaging",
      "ercp",
      "ptc",
      "liver trauma"
    ],
    "order_index": 7,
    "golden_tip": [
      "Ultrasound is the FIRST-LINE hepatobiliary test: it detects bile duct dilatation, gallstones, liver tumors and liver cysts and guides percutaneous liver biopsy. The exam trap that ultrasound cannot diagnose a liver cyst is FALSE.",
      "Pancreatitis, cholangitis, bleeding and perforation are complications of ERCP (related to sphincterotomy) - NOT of MRCP. MRCP is the non-invasive diagnostic technique; ERCP is the invasive, mainly therapeutic one.",
      "The 3 hepatic veins (right, left and median) leave from the BACK of the liver - they are NOT in the porta hepatis. Porta hepatis contents from posterior to anterior (VAD): portal vein, then hepatic arteries, then bile ducts.",
      "A haemodynamically UNSTABLE patient with a lower chest or upper abdominal stab or crushing injury goes to the operating theatre for exploratory laparotomy after ABC resuscitation - never to the CT scanner.",
      "Stop conservative treatment of blunt liver trauma when: 1) blood loss continues despite correction of underlying coagulopathy, or 2) signs of generalized peritonitis develop."
    ]
  },
  "concepts": [
    {
      "id": "surg_Liver_L1_c01",
      "lecture_id": "surg_Liver_L1",
      "title": "Liver Surgical Anatomy and Physiology",
      "summary_ar": "يؤسس هذا المفهوم أساسات جراحة الكبد: الكبد أكبر غدة في الجسم (1.5 كغ) محاطة بمحفظة ليفية كاملة ومغطاة بالبريتون جزئياً، وله أربع وظائف أساسية يقيسها تحليل وظائف الكبد. ثم التشريح الجراحي: الفصوص الأربعة، ومحتوى سرة الكبد بترتيب VAD من الخلف إلى الأمام (وريد بابي، شرايين كبدية، ثم قنوات صفراوية مع الأوعية اللمفاوية والأعصاب)، والتروية المزدوجة 75% وريد بابي يحمل دماً منزوع الأكسجين مع المغذيات و25% شرايين كبدية مؤكسجة، والفصيصات السداسية بثلاثي بابي في كل زاوية، والأوردة الكبدية الثلاثة (أيمن وأيسر وأوسط) الخارجة من ظهر الكبد لا من سرة الكبد، وأخيراً قطاعات Couinaud من I إلى VIII على جانبي خط حفر المرارة.",
      "sections": [
        {
          "heading": "Lecture Objectives, Attribution and the Liver at a Glance",
          "body_text": "This first liver lecture of the 2025 series is delivered by Dr Noori Hannon Jasim, Consultant General and Gastrointestinal Surgeon (MD, FRCS, FACS, FICMS and PhD GI Surgery, United Kingdom), and states three objectives: **1. Surgical anatomy of the liver (liver segments), 2. Investigations of the hepatobiliary system, 3. Liver trauma.** (The original slide deck ends with an aerial (satellite or drone-view) photograph that depicts an urban and suburban landscape as its subject matter: its central feature is a large complex of multi-story buildings - likely a hospital, university or corporate campus - arranged in a grid-like pattern and bordered by a multi-lane highway, with dense residential housing with red-tiled roofs to the south and west, green parkland with mature trees and smaller auxiliary buildings in the surroundings; it appears to be a contextual introductory image showing the location of the medical school or teaching hospital. The final slide is blank. Based on the exhaustive visual extraction and image descriptions of the original slides, the photos, figures, tables, diagrams, flowcharts, classifications and algorithms of the lecture have all been transferred, and their transcription appears inside the relevant sections below.)\n\nThe liver is the **largest gland in the body, weighing about 1.5 kg**. It is **completely surrounded by a fibrous capsule** (the Glisson capsule) but is **only partially covered by peritoneum**: where peritoneum is absent, the **bare area** of the liver lies in direct contact with the diaphragm. This capsule-versus-peritoneum distinction matters clinically: superficial tears may be tamponaded by an intact capsule, and the peritoneal reflections form the ligamentous attachments the surgeon must divide when mobilizing the liver.",
          "key_points": [
            "Largest gland in the body: about 1.5 kg.",
            "Completely surrounded by a fibrous capsule (Glisson capsule); only PARTIALLY covered by peritoneum (bare area).",
            "Lecture objectives: surgical anatomy with segments, hepatobiliary investigations, liver trauma."
          ]
        },
        {
          "heading": "Functions of the Liver and Liver Function Tests (LFT)",
          "body_text": "The lecture lists **four functions of the liver**:\n- **1. Production and secretion of bilirubin (the bile pigment) and bile salts.**\n- **2. Involvement in many metabolic activities** related to carbohydrate (CHO), fat, protein, hormones and drugs.\n- **3. Filtration of blood from bacteria and foreign particles** (the reticuloendothelial function of the Kupffer cells lining the sinusoids).\n- **4. Maintaining core body temperature and pH balance.**\n\nThe laboratory reflection of these functions is the **liver function test (LFT) panel: bilirubin, alkaline phosphatase (Alk phosphatase), aspartate transaminase (AST), alanine transaminase (ALT), gamma-glutamyl transpeptidase (GGT), albumin (Alb) and prothrombin time (PT).** For exam interpretation: bilirubin reflects pigment handling; alkaline phosphatase and GGT mark cholestasis; AST and ALT mark hepatocellular injury; and albumin with PT reflect the synthetic function of the liver (the clotting factors are vitamin-K-dependent liver products).",
          "key_points": [
            "Four functions: bile production (bilirubin pigment and salts), metabolism (CHO, fat, protein, hormones, drugs), filtration of blood from bacteria and foreign particles, core temperature and pH balance.",
            "LFT panel: bilirubin, alkaline phosphatase, AST, ALT, GGT, albumin, PT.",
            "Albumin and PT = synthetic function; AST/ALT = hepatocellular injury; ALP and GGT = cholestasis."
          ],
          "check": {
            "prompt": "Which two components of the LFT panel best reflect the synthetic function of the liver?",
            "options": [
              "Albumin and prothrombin time (PT)",
              "AST and ALT",
              "Bilirubin and alkaline phosphatase",
              "GGT and AST",
              "Bilirubin and albumin"
            ],
            "correct_index": 0,
            "explanation_ar": "الألبومين وزمن البروثرومبين يعكسان الوظيفة التركيبية للكبد لأن الكبد يصنعهما، بينما AST وALT تدلان على تلف الخلايا الكبدية، والفوسفاتيز القلوي مع GGT على الركود الصفراوي، والبيليروبين على التعامل مع صبغة الصفراء."
          }
        },
        {
          "heading": "Gross Anatomy: Lobes, Porta Hepatis (VAD Order), Nerves, Blood Supply and Ligaments",
          "body_text": "**Lobes:** the anatomical lobes of the liver are the **right, left, caudate and quadrate** lobes.\n\n**Porta hepatis (the liver hilum):** a transverse fissure on the inferior surface through which the structures pass **from posterior to anterior in the VAD order**: the **portal vein** (V) lies most posterior, then the **right and left hepatic arteries** (A), then the **right and left hepatic ducts** (D) with their continuity as the **common hepatic duct and then the common bile duct (CBD)**; **lymphatics and nerves** also pass through the hilum. This single VAD arrangement is the roadmap for any hilar dissection: it tells the surgeon what lies behind what during cholecystectomy, bile duct exploration and control of hepatic inflow.\n\n**Nerves:** sympathetic fibers from the **coeliac plexus** and parasympathetic fibers from the **vagus nerve**.\n\n**Blood supply - a double inflow:** the **portal vein contributes about 75%** of blood flow, carrying **deoxygenated blood plus nutrients from the digestive system** (absorbed food, drugs and intestinal products delivered directly to the hepatocytes), while the **hepatic arteries contribute about 25%**, carrying **oxygenated blood** to meet the oxygen demand of the parenchyma.\n\n**Peritoneal ligaments of the liver:** the **falciform ligament**, suspending the liver from the anterior abdominal wall and containing the ligamentum teres, and the **lesser omentum**, connecting the lesser curvature of the stomach and the duodenum to the liver and carrying the portal triad in its free edge (the hepatoduodenal ligament).",
          "key_points": [
            "Lobes: right, left, caudate and quadrate.",
            "Porta hepatis posterior-to-anterior = VAD: portal vein, right and left hepatic arteries, right and left hepatic ducts (to common hepatic duct then CBD), plus lymphatics and nerves.",
            "Nerves: sympathetics from the coeliac plexus, parasympathetics from the vagus.",
            "Portal vein 75% (deoxygenated blood plus nutrients); hepatic arteries 25% (oxygenated blood).",
            "Peritoneal ligaments: falciform ligament and lesser omentum."
          ],
          "check": {
            "prompt": "During hilar dissection, what is the order of the main structures in the porta hepatis from posterior to anterior?",
            "options": [
              "Portal vein, then right and left hepatic arteries, then right and left hepatic ducts (VAD)",
              "Hepatic arteries, then portal vein, then hepatic ducts",
              "Hepatic ducts, then hepatic arteries, then portal vein",
              "Portal vein, then hepatic ducts, then hepatic arteries",
              "Hepatic veins, then portal vein, then hepatic ducts"
            ],
            "correct_index": 0,